{
  "$schema": "https://json-schema.org/draft/2020-12/schema",
  "$id": "https://venture-factory.local/schemas/opportunity.schema.json",
  "title": "Opportunity",
  "description": "A discovered market opportunity surfaced by the Research / Discovery agents in the AI Venture Factory. One Opportunity represents a single problem-market pairing that has not yet been promoted to an Experiment.",
  "type": "object",
  "additionalProperties": false,
  "required": [
    "id",
    "discovered_at",
    "source",
    "problem_statement",
    "target_segment",
    "geo",
    "signal_strength",
    "keywords",
    "notes"
  ],
  "properties": {
    "id": {
      "type": "string",
      "description": "Crockford-base32 ULID (26 chars). Generated by the Research agent at creation time.",
      "pattern": "^[0-9A-HJKMNP-TV-Z]{26}$"
    },
    "discovered_at": {
      "type": "string",
      "description": "ISO 8601 timestamp WITH timezone offset (e.g., 2026-05-31T14:30:00+03:00 for IDT). UTC also acceptable.",
      "format": "date-time",
      "pattern": "^\\d{4}-\\d{2}-\\d{2}T\\d{2}:\\d{2}:\\d{2}(?:\\.\\d+)?(?:Z|[+-]\\d{2}:\\d{2})$"
    },
    "source": {
      "type": "object",
      "description": "Where this opportunity was observed.",
      "additionalProperties": false,
      "required": ["type", "url", "snippet"],
      "properties": {
        "type": {
          "type": "string",
          "enum": [
            "reddit",
            "hn",
            "twitter",
            "linkedin",
            "forum",
            "review_site",
            "job_board",
            "podcast",
            "newsletter",
            "support_ticket",
            "operator_intuition",
            "other"
          ]
        },
        "url": {
          "type": "string",
          "format": "uri",
          "description": "Direct link to the observed signal. Required even for operator_intuition (use a placeholder URL pointing to operator's notes file)."
        },
        "snippet": {
          "type": "string",
          "minLength": 1,
          "maxLength": 2000,
          "description": "Quoted excerpt or short summary of the signal. No PII; redact personal names/handles to first-initial only."
        }
      }
    },
    "problem_statement": {
      "type": "string",
      "minLength": 30,
      "maxLength": 500,
      "description": "Plain-language statement of the problem this opportunity addresses. 30-500 chars enforces 'concrete but not yet a pitch'."
    },
    "target_segment": {
      "type": "string",
      "minLength": 3,
      "maxLength": 200,
      "description": "Who has this problem. Role + industry + size where applicable."
    },
    "geo": {
      "type": "string",
      "description": "Primary geography. ISO 3166-1 alpha-2 country code, or 'GLOBAL', or 'IL' for Israel-specific.",
      "pattern": "^([A-Z]{2}|GLOBAL)$"
    },
    "signal_strength": {
      "type": "integer",
      "minimum": 1,
      "maximum": 5,
      "description": "1 = single weak data point; 5 = multiple independent, recent, paid signals."
    },
    "keywords": {
      "type": "array",
      "description": "Searchable tags. Lowercase, kebab-case, 1-30 chars each.",
      "minItems": 1,
      "maxItems": 30,
      "items": {
        "type": "string",
        "pattern": "^[a-z0-9][a-z0-9-]{0,29}$"
      },
      "uniqueItems": true
    },
    "notes": {
      "type": "string",
      "description": "Free-form operator or agent notes. Empty string allowed.",
      "maxLength": 5000
    },
    "related_opportunities": {
      "type": "array",
      "description": "Other Opportunity IDs that overlap with this one (e.g., adjacent segments, duplicate-but-different-source).",
      "items": {
        "type": "string",
        "pattern": "^[0-9A-HJKMNP-TV-Z]{26}$"
      },
      "uniqueItems": true
    },
    "score": {
      "type": "object",
      "description": "Computed score breakdown. Dimension names must match keys in config/scoring_model.yaml.",
      "additionalProperties": false,
      "required": ["total", "per_dimension", "scored_at"],
      "properties": {
        "total": {
          "type": "number",
          "minimum": 0,
          "maximum": 100
        },
        "per_dimension": {
          "type": "object",
          "description": "Map of scoring dimension name -> numeric score. Keys must exist in config/scoring_model.yaml.",
          "additionalProperties": {
            "type": "number"
          }
        },
        "scored_at": {
          "type": "string",
          "format": "date-time",
          "pattern": "^\\d{4}-\\d{2}-\\d{2}T\\d{2}:\\d{2}:\\d{2}(?:\\.\\d+)?(?:Z|[+-]\\d{2}:\\d{2})$"
        },
        "model_version": {
          "type": "string",
          "description": "Version tag of the scoring model used."
        }
      }
    },
    "status": {
      "type": "string",
      "enum": ["candidate", "validated", "building", "live", "killed"],
      "description": "Lifecycle stage of this opportunity. Promoted to an Experiment when status becomes 'building'."
    }
  }
}
